{
  "manifestVersion": "1.1",
  "id": "org.neovim.neovim",
  "name": "Neovim",
  "homepage": "https://neovim.io/",
  "source": {
    "pluginId": "Wintainium.provider.github-releases",
    "requiredContractVersion": "1",
    "settings": {
      "repository": "neovim/neovim"
    }
  },
  "installer": {
    "pluginId": "Wintainium.installer.portable-zip",
    "requiredContractVersion": "1",
    "settings": {
      "entryPoint": "nvim-win64/bin/nvim.exe"
    }
  },
  "reconciliation": {
    "pluginId": "Wintainium.reconciliation.valid-fixture",
    "requiredContractVersion": "1",
    "settings": {}
  },
  "release": {
    "channel": "stable"
  },
  "artifact": {
    "formats": ["zip"],
    "architectures": ["x64"],
    "allowUnknownArchitecture": false
  }
}
