{"manifestVersion": "1.1", "id": "org.example.no-provider", "name": "No Provider", "source": {"pluginId": "Wintainium.provider.not-installed", "requiredContractVersion": "1", "settings": {}}, "installer": {"pluginId": "Wintainium.installer.portable-zip", "requiredContractVersion": "1", "settings": {}}, "reconciliation": {"pluginId": "Wintainium.reconciliation.valid-fixture", "requiredContractVersion": "1", "settings": {}}, "release": {"channel": "stable"}, "artifact": {"formats": ["zip"], "architectures": ["x64"]}}