{
  "manifestVersion": "1.1",
  "id": "com.github.desktop",
  "name": "GitHub Desktop",
  "homepage": "https://desktop.github.com/",
  "source": {
    "pluginId": "Wintainium.provider.github-releases",
    "requiredContractVersion": "1",
    "settings": {
      "repository": "desktop/desktop"
    }
  },
  "installer": {
    "pluginId": "Wintainium.installer.exe",
    "requiredContractVersion": "1",
    "settings": {}
  },
  "reconciliation": {
    "pluginId": "Wintainium.reconciliation.valid-fixture",
    "requiredContractVersion": "1",
    "settings": {}
  },
  "release": {
    "channel": "stable"
  },
  "artifact": {
    "formats": ["exe"],
    "architectures": ["x64"]
  }
}
