{
  "manifestVersion": "1.1",
  "id": "com.github.cli",
  "name": "GitHub CLI",
  "homepage": "https://cli.github.com/",
  "source": {
    "pluginId": "Wintainium.provider.github-releases",
    "requiredContractVersion": "1",
    "settings": {
      "repository": "cli/cli"
    }
  },
  "installer": {
    "pluginId": "Wintainium.installer.msi",
    "requiredContractVersion": "1",
    "settings": {}
  },
  "reconciliation": {
    "pluginId": "Wintainium.reconciliation.valid-fixture",
    "requiredContractVersion": "1",
    "settings": {}
  },
  "release": {
    "channel": "stable"
  },
  "artifact": {
    "formats": ["msi"],
    "architectures": ["x64"]
  }
}
