{
  "manifestVersion": "1.1",
  "id": "org.example.incompatible",
  "name": "Incompatible Installer",
  "source": {
    "pluginId": "Wintainium.provider.github-releases",
    "requiredContractVersion": "1",
    "settings": {}
  },
  "installer": {
    "pluginId": "Wintainium.installer.msi-only",
    "requiredContractVersion": "1",
    "settings": {}
  },
  "reconciliation": {
    "pluginId": "Wintainium.reconciliation.valid-fixture",
    "requiredContractVersion": "1",
    "settings": {}
  },
  "release": {
    "channel": "stable"
  },
  "artifact": {
    "formats": ["zip"],
    "architectures": ["x64"]
  }
}
