{"manifestVersion": "1.1", "id": "org.example.prohibited", "name": "Example Application", "source": {"pluginId": "Wintainium.provider.github-releases", "requiredContractVersion": "1", "settings": {"repository": "example/application", "apiToken": "must-not-be-here"}}, "installer": {"pluginId": "Wintainium.installer.portable-zip", "requiredContractVersion": "1", "settings": {}}, "reconciliation": {"pluginId": "Wintainium.reconciliation.valid-fixture", "requiredContractVersion": "1", "settings": {}}, "release": {"channel": "stable"}, "artifact": {"formats": ["zip"], "architectures": ["x64"]}}